{
  "schema_version": 1,
  "command": "install-candidate-activate-preview",
  "target": "codex",
  "previous_version": "2.0.0-alpha.5",
  "candidate_version": "2.0.0-alpha.6",
  "previous_install_id": "native-payload-1111111111111111111111111111111111111111111111111111111111111111",
  "previous_pack_sha256": "2222222222222222222222222222222222222222222222222222222222222222",
  "candidate_digest_sha256": "3333333333333333333333333333333333333333333333333333333333333333",
  "cli_plan_sha256": "4444444444444444444444444444444444444444444444444444444444444444",
  "preflight_digest_sha256": "5555555555555555555555555555555555555555555555555555555555555555",
  "mutation": "none"
}
